### ISSUE TITLE
problem with reconnection after redeployment

### ISSUE THREAD

**Issue by dev4iotatgps** [jisotalo/node-red-contrib-ads-client#26]
Hi,

I have a problem, that the Node-Red ads-client does not reconnect after a redeployment of Node-Red or after restart of the hardware. I use following Lib versions: 

`+-- node-red-contrib-ads-client@1.4.0
+-- node-red@3.0.2 -> ./../../opt/nodered/lib/node_modules/node-red
+-- npm@9.5.0 -> ./../../opt/npm/lib/node_modules/npm`

and following Hardware: Advantech ICR3231 LTE-Router

Very strange behaviour: 

I use a ADS - Connection Status node and several Subscribe nodes from the ads-client lib. After Deployment of the node-red flow, the ads nodes lose the connection to the Beckhoff PLC (TwinCAT 3).

Bevor deploy
![image](https://github.com/jisotalo/node-red-contrib-ads-client/assets/136588106/29dd20dc-a19b-491b-a587-5e1ff4c5f3ca)

After deploy
![image](https://github.com/jisotalo/node-red-contrib-ads-client/assets/136588106/95ef2af6-4bb7-4a98-b1d2-f6fb7dfb76e9)

After I apply the ethernet settings in the advantech router, the ads node reconnect to the Beckhoff PLC.
![image](https://github.com/jisotalo/node-red-contrib-ads-client/assets/136588106/5af2a1af-f8e1-4625-89eb-8337aa58c09e)
![image](https://github.com/jisotalo/node-red-contrib-ads-client/assets/136588106/e4b2790f-d755-4683-95ec-e6adc7037946)

Here is the Log of the process: (unfortuneatly with debug level 3 I get not more information)
`# tail -f module-nodered
{
  fill: 'green',
  shape: 'dot',
  text: 'Subscribed',
  source: {
    id: '9f12b574bd018a50',
    type: 'ads-client-subscribe',
    name: 'FRONT_TIME_TOOL_CHANGE'
  }
}
2023-06-29 16:22:36 [debug] saved flow revision: e392abca8ceadeb6cf067642057898cd
2023-06-29 16:22:36 [info] Stopping flows
2023-06-29 16:22:36 [debug] red/nodes/flows.stop : stopping flow : adbad0c8def14ca1
2023-06-29 16:22:36 [debug] red/nodes/flows.stop : stopping flow : 8ea35e728cd8dbf3
2023-06-29 16:22:36 [debug] red/nodes/flows.stop : stopping flow : 656dcc8b191c5056
2023-06-29 16:22:36 [debug] red/nodes/flows.stop : stopping flow : global
2023-06-29 16:22:36 [info] [ads-client-connection:41398cdf55542ea0] Disconnecting from 192.168.2.3.1.1:851 and unsubscribing from all...
2023-06-29 16:22:36 [info] [ads-client-connection:41398cdf55542ea0] Disconnected from 192.168.2.3.1.1:851
2023-06-29 16:22:36 [info] Stopped flows
2023-06-29 16:22:36 [info] Updated flows
2023-06-29 16:22:36 [info] Starting flows
2023-06-29 16:22:36 [debug] red/nodes/flows.start : starting flow : global
2023-06-29 16:22:36 [debug] red/nodes/flows.start : starting flow : adbad0c8def14ca1
2023-06-29 16:22:36 [debug] red/nodes/flows.start : starting flow : 8ea35e728cd8dbf3
2023-06-29 16:22:36 [debug] red/nodes/flows.start : starting flow : 656dcc8b191c5056
2023-06-29 16:22:36 [info] [ads-client-connection:41398cdf55542ea0] Connecting to 192.168.2.3.1.1:851...
2023-06-29 16:22:36 [info] Started flows
2023-06-29 16:22:37 [info] [mqtt-broker:hivemq] Connected to broker: mqtts://mqtt-broker.t-matix.io:8883
2023-06-29 16:22:37 [error] [file in:buffer_read] Error: ENOENT: no such file or directory, open '/var/data/node-red/mqtt_buffer'
2023-06-29 16:22:37 [debug] [exec:3c5f993fbf211703] rm /var/data/node-red/mqtt_buffer
2023-06-29 16:22:37 [debug] [exec:3c5f993fbf211703] error:Error: Command failed: rm /var/data/node-red/mqtt_buffer
rm: can't remove '/var/data/node-red/mqtt_buffer': No such file or directory

2023-06-29 16:22:38 [info] [ads-client-connection:41398cdf55542ea0] Connecting to 192.168.2.3.1.1:851 failed, keeping trying..
2023-06-29 16:22:38 [warn] [ads-client-connection:41398cdf55542ea0] Failed to connect 192.168.2.3.1.1:851 at startup: ClientException: Connection to 192.168.2.3:48898 failed (timeout) - No response from router in 2000 ms
2023-06-29 16:22:38 [error] [ads-client-subscribe:FRONT_TIME_TOOL_CHANGE] Error: Not connected to the target, retrying in the background.
2023-06-29 16:22:38 [info] [debug:debug 6]
{
  fill: 'red',
  shape: 'dot',
  text: 'Not connected',
  source: {
    id: 'd7afa6af1768a7a1',
    type: 'ads-client-connection-status',
    name: ''
  }
}
2023-06-29 16:22:38 [info] [debug:debug 6]
{
  fill: 'red',
  shape: 'dot',
  text: 'Error: Not connected',
  source: {
    id: '9f12b574bd018a50',
    type: 'ads-client-subscribe',
    name: 'FRONT_TIME_TOOL_CHANGE'
  }
}
2023-06-29 16:22:38 [info] [debug:debug 6]
{
  fill: 'red',
  shape: 'dot',
  text: 'Error: Not connected',
  source: {
    id: '2e4f302a8e8dd521',
    type: 'ads-client-read-symbol',
    name: 'FRONT_TIME_TOOL_CHANGE'
  }
}
2023-06-29 16:22:38 [info] [debug:debug 5] ClientException: Connection to 192.168.2.3:48898 failed (timeout) - No response from router in 2000 ms
2023-06-29 16:22:38 [info] [debug:debug 6]
{
  fill: 'red',
  shape: 'dot',
  text: 'Error: Not connected, retrying...',
  source: {
    id: '9f12b574bd018a50',
    type: 'ads-client-subscribe',
    name: 'FRONT_TIME_TOOL_CHANGE'
  }
}
2023-06-29 16:22:38 [info] [debug:debug 6]
{
  fill: 'red',
  shape: 'dot',
  text: 'Error: Not connected',
  source: {
    id: '6e48ed40dd6ff62c',
    type: 'ads-client-read-symbol',
    name: 'FRONT_SPINDLE_TOOL_CLAMPING'
  }
}
2023-06-29 16:22:38 [info] [debug:debug 5] ClientException: Connection to 192.168.2.3:48898 failed (timeout) - No response from router in 2000 ms
2023-06-29 16:22:38 [info] [debug:debug 6]
{
  fill: 'red',
  shape: 'dot',
  text: 'Error: Not connected',
  source: {
    id: '4c31795556267fe2',
    type: 'ads-client-read-symbol',
    name: 'FRONT_SPINDLE_TOOL_RELEASE'
  }
}
2023-06-29 16:22:38 [info] [debug:debug 5] ClientException: Connection to 192.168.2.3:48898 failed (timeout) - No response from router in 2000 ms
2023-06-29 16:22:38 [info] [debug:debug 6]
{
  fill: 'red',
  shape: 'dot',
  text: 'Error: Not connected',
  source: {
    id: '174fbeb06d4d43d4',
    type: 'ads-client-read-symbol',
    name: 'REAR_TIME_TOOL_CHANGE'
  }
}
2023-06-29 16:22:38 [info] [debug:debug 5] ClientException: Connection to 192.168.2.3:48898 failed (timeout) - No response from router in 2000 ms
2023-06-29 16:22:38 [info] [debug:debug 6]
{
  fill: 'red',
  shape: 'dot',
  text: 'Error: Not connected',
  source: {
    id: 'e442289492c5f76b',
    type: 'ads-client-read-symbol',
    name: 'REAR_SPINDLE_TOOL_CLAMPING'
  }
}
2023-06-29 16:22:38 [info] [debug:debug 5] ClientException: Connection to 192.168.2.3:48898 failed (timeout) - No response from router in 2000 ms
2023-06-29 16:22:38 [info] [debug:debug 6]
{
  fill: 'red',
  shape: 'dot',
  text: 'Error: Not connected',
  source: {
    id: '15ff5277958bb6d2',
    type: 'ads-client-read-symbol',
    name: 'REAR_SPINDLE_TOOL_RELEASE'
  }
}
2023-06-29 16:22:38 [info] [debug:debug 5] ClientException: Connection to 192.168.2.3:48898 failed (timeout) - No response from router in 2000 ms
2023-06-29 16:22:42 [info] [debug:debug 6]
{
  fill: 'red',
  shape: 'dot',
  text: 'Error: Not connected, retrying...',
  source: {
    id: '9f12b574bd018a50',
    type: 'ads-client-subscribe',
    name: 'FRONT_TIME_TOOL_CHANGE'
  }
}
2023-06-29 16:22:46 [info] [debug:debug 6]
{
  fill: 'red',
  shape: 'dot',
  text: 'Error: Not connected, retrying...',
  source: {
    id: '9f12b574bd018a50',
    type: 'ads-client-subscribe',
    name: 'FRONT_TIME_TOOL_CHANGE'
  }
}
2023-06-29 16:22:46 [error] [snmp:INFO] RequestTimedOutError: Request timed out
2023-06-29 16:22:49 [info] [debug:debug 6]
{
  fill: 'green',
  shape: 'dot',
  text: 'Connected',
  source: {
    id: 'd7afa6af1768a7a1',
    type: 'ads-client-connection-status',
    name: ''
  }
}
2023-06-29 16:22:49 [info] [debug:debug 6]
{
  fill: 'green',
  shape: 'dot',
  text: 'Subscribed',
  source: {
    id: '9f12b574bd018a50',
    type: 'ads-client-subscribe',
    name: 'FRONT_TIME_TOOL_CHANGE'
  }
}`

Thank you in advance!

**Comment by dev4iotatgps** [comment]
It seems, that the client does not send the propper FIN bit to the Server
![image](https://github.com/jisotalo/node-red-contrib-ads-client/assets/136588106/4397e88e-47a9-4992-b47a-2d50cbe31bc3)

This is the tcpdump, when I press the deploy button in Node-Red. For the connection close the client should send the FIN bit to the server, and not the FIN-ACK, to close the connection.

`10:07:53.376115 IP (tos 0x0, ttl 128, id 29256, offset 0, flags [DF], proto TCP (6), length 82)
    192.168.2.3.48898 > 192.168.2.10.45599: Flags [P.], cksum 0xdab1 (correct), seq 1961:2003, ack 1778, win 8208, length 42
10:07:53.389961 IP (tos 0x0, ttl 64, id 43242, offset 0, flags [DF], proto TCP (6), length 82)
    192.168.2.10.45599 > 192.168.2.3.48898: Flags [P.], cksum 0xeab6 (correct), seq 1778:1820, ack 2003, win 993, length 42
10:07:53.392146 IP (tos 0x0, ttl 128, id 29257, offset 0, flags [DF], proto TCP (6), length 82)
    192.168.2.3.48898 > 192.168.2.10.45599: Flags [P.], cksum 0xd95d (correct), seq 2003:2045, ack 1820, win 8208, length 42
10:07:53.403457 IP (tos 0x0, ttl 64, id 43243, offset 0, flags [DF], proto TCP (6), length 40)
    **192.168.2.10.45599 > 192.168.2.3.48898: Flags [F.]**, cksum 0x0893 (correct), seq 1820, ack 2045, win 993, length 0
10:07:53.404140 IP (tos 0x0, ttl 128, id 29258, offset 0, flags [DF], proto TCP (6), length 40)
    **192.168.2.3.48898 > 192.168.2.10.45599: Flags [.]**, cksum 0xec63 (correct), seq 2045, ack 1821, win 8208, length 0
10:07:53.404316 IP (tos 0x0, ttl 128, id 29259, offset 0, flags [DF], proto TCP (6), length 40)
    **192.168.2.3.48898 > 192.168.2.10.45599: Flags [F.]**, cksum 0xec62 (correct), seq 2045, ack 1821, win 8208, length 0
10:07:53.404405 IP (tos 0x0, ttl 64, id 43244, offset 0, flags [DF], proto TCP (6), length 40)
    **192.168.2.10.45599 > 192.168.2.3.48898: Flags [.]**, cksum 0x0892 (correct), seq 1821, ack 2046, win 993, length 0
10:07:54.201757 IP (tos 0x0, ttl 64, id 30368, offset 0, flags [DF], proto TCP (6), length 60)
    10.89.8.10.33901 > 192.168.2.3.48898: Flags [S], cksum 0x10a4 (correct), seq 2558094520, win 29200, options [mss 1460,sackOK,TS val 1916286308 ecr 0,nop,wscale 6], length 0
10:07:55.239178 IP (tos 0x0, ttl 64, id 30369, offset 0, flags [DF], proto TCP (6), length 60)
    10.89.8.10.33901 > 192.168.2.3.48898: Flags [S], cksum 0x0c96 (correct), seq 2558094520, win 29200, options [mss 1460,sackOK,TS val 1916287346 ecr 0,nop,wscale 6], length 0`

**Comment by dev4iotatgps** [comment]
Found the Problem!

With my Hardware (Advantech ICR32xx) I use a VPN Connection to the LTE-Router. So when the connection to the client 192.168.2.10 will be closed, the ADS-router trys to connect to the vpn adress 10.89.8.10 --> this blocks then the connection for the client 192.168.2.10..

**Comment by jisotalo** [comment]
Hi! Sorry I didn't got time to look into this, luckily you sorted it out. Thanks for letting me know!

**Comment by dev4iotatgps** [comment]
I have found the Problem, but is there also a solution for that? At the moment I just restart the openvpn1 client of my router, that the connection will be interrupted and the ads-client connects to the IP, which is configured at the node.

![image](https://github.com/jisotalo/node-red-contrib-ads-client/assets/136588106/8ccb38a2-2a6e-41a6-806a-152b0d140b93)

It should never happen, that the connection will be established with the openvpn1 IP adress if a local IP is configured?!

Thank you!
